{
  "$schema": "./versions.schema.json",
  "formatVersion": 1,
  "catalogScope": {
    "firstRelease": "1.8",
    "lastRelease": "26.2",
    "officialReleaseCount": 74,
    "paperBaselineCount": 53,
    "paperGapCount": 21,
    "implementedSourceLineCount": 1
  },
  "frozenUpstream": {
    "refreshedAt": "2026-08-09T12:12:01Z",
    "sources": {
      "mojang": "https://launchermeta.mojang.com/mc/game/version_manifest_v2.json",
      "paper": "https://fill.papermc.io/v3/projects/paper"
    },
    "note": "Regenerate offline from upstream-snapshot.json; use --refresh only for an explicit metadata update."
  },
  "capabilityKeys": [
    "pluginApi",
    "victusCore",
    "nativeConfig",
    "dab",
    "asyncChunkSend",
    "lagDoctor",
    "metrics",
    "parallelTicking",
    "regionizedThreading",
    "fabricBridge",
    "neoForgeBridge"
  ],
  "versions": [
    {
      "minecraftVersion": "26.2",
      "family": "26.2",
      "mojang": {
        "releaseTime": "2026-06-16T12:03:33+00:00",
        "manifestSha1": "4b74f58f68a2baae3547d5a20274079f29cafc06",
        "manifestUrl": "https://piston-meta.mojang.com/v1/packages/4b74f58f68a2baae3547d5a20274079f29cafc06/26.2.json"
      },
      "paperBaseline": true,
      "availability": "implemented",
      "unavailableReason": null,
      "java": {
        "build": 25,
        "runtime": 25
      },
      "buildSystem": {
        "generation": "modern-paperweight",
        "gradle": "9.4.1",
        "paperweight": "2.0.0-beta.21",
        "task": "./gradlew applyAllPatches build",
        "artifactPath": "victus-server/build/libs/*.jar"
      },
      "sourceBranch": "main",
      "sourceImplemented": true,
      "supportTier": "beta",
      "capabilities": {
        "pluginApi": true,
        "victusCore": true,
        "nativeConfig": true,
        "dab": true,
        "asyncChunkSend": true,
        "lagDoctor": true,
        "metrics": true,
        "parallelTicking": false,
        "regionizedThreading": false,
        "fabricBridge": false,
        "neoForgeBridge": false
      },
      "tests": {
        "catalog": true,
        "patchApply": true,
        "unit": true,
        "boot": false,
        "bannerOrdering": false
      },
      "publicationEligible": false,
      "upstream": {
        "provider": "Paper",
        "project": "paper",
        "version": "26.2",
        "build": 111,
        "channel": "stable",
        "buildTime": "2026-08-07T16:16:19Z",
        "commit": "f5706462f8833a858fee5fe1bccc05b60c248922",
        "download": {
          "url": "https://fill-data.papermc.io/v1/objects/3ec81e3ea50cc6090b94aab024491846a202702e8a874308a5d7510f6b3aa012/paper-26.2-111.jar",
          "sha256": "3ec81e3ea50cc6090b94aab024491846a202702e8a874308a5d7510f6b3aa012",
          "size": 61859543
        },
        "sourceRef": "75c0b485bf038c175d6f3e6efc67519cd5cd524d",
        "sourceBuild": 62
      }
    },
    {
      "minecraftVersion": "26.1.2",
      "family": "26.1",
      "mojang": {
        "releaseTime": "2026-04-09T10:12:23+00:00",
        "manifestSha1": "d3fd35143b65049d54ffc0dd8e51bfbad6d958d8",
        "manifestUrl": "https://piston-meta.mojang.com/v1/packages/d3fd35143b65049d54ffc0dd8e51bfbad6d958d8/26.1.2.json"
      },
      "paperBaseline": true,
      "availability": "planned",
      "unavailableReason": null,
      "java": {
        "build": 25,
        "runtime": 25
      },
      "buildSystem": {
        "generation": "modern-paperweight",
        "gradle": null,
        "paperweight": null,
        "task": null,
        "artifactPath": null
      },
      "sourceBranch": null,
      "sourceImplemented": false,
      "supportTier": "planned",
      "capabilities": {
        "pluginApi": false,
        "victusCore": false,
        "nativeConfig": false,
        "dab": false,
        "asyncChunkSend": false,
        "lagDoctor": false,
        "metrics": false,
        "parallelTicking": false,
        "regionizedThreading": false,
        "fabricBridge": false,
        "neoForgeBridge": false
      },
      "tests": {
        "catalog": true,
        "patchApply": false,
        "unit": false,
        "boot": false,
        "bannerOrdering": false
      },
      "publicationEligible": false,
      "upstream": {
        "provider": "Paper",
        "project": "paper",
        "version": "26.1.2",
        "build": 74,
        "channel": "stable",
        "buildTime": "2026-07-06T16:51:09Z",
        "commit": null,
        "download": {
          "url": "https://fill-data.papermc.io/v1/objects/1d70b1dab9cf4a6de615209a536f3a45a2186240253c428213ce2188ab95e5f7/paper-26.1.2-74.jar",
          "sha256": "1d70b1dab9cf4a6de615209a536f3a45a2186240253c428213ce2188ab95e5f7",
          "size": 52893229
        }
      }
    },
    {
      "minecraftVersion": "26.1.1",
      "family": "26.1",
      "mojang": {
        "releaseTime": "2026-04-01T09:06:36+00:00",
        "manifestSha1": "832bdf7eafaff2edb3106e89bacdc2844e50561d",
        "manifestUrl": "https://piston-meta.mojang.com/v1/packages/832bdf7eafaff2edb3106e89bacdc2844e50561d/26.1.1.json"
      },
      "paperBaseline": true,
      "availability": "planned",
      "unavailableReason": null,
      "java": {
        "build": 25,
        "runtime": 25
      },
      "buildSystem": {
        "generation": "modern-paperweight",
        "gradle": null,
        "paperweight": null,
        "task": null,
        "artifactPath": null
      },
      "sourceBranch": null,
      "sourceImplemented": false,
      "supportTier": "planned",
      "capabilities": {
        "pluginApi": false,
        "victusCore": false,
        "nativeConfig": false,
        "dab": false,
        "asyncChunkSend": false,
        "lagDoctor": false,
        "metrics": false,
        "parallelTicking": false,
        "regionizedThreading": false,
        "fabricBridge": false,
        "neoForgeBridge": false
      },
      "tests": {
        "catalog": true,
        "patchApply": false,
        "unit": false,
        "boot": false,
        "bannerOrdering": false
      },
      "publicationEligible": false,
      "upstream": {
        "provider": "Paper",
        "project": "paper",
        "version": "26.1.1",
        "build": 29,
        "channel": "alpha",
        "buildTime": "2026-04-06T17:01:17Z",
        "commit": "106a934df2f892f5895b239f80c12bf13c164657",
        "download": {
          "url": "https://fill-data.papermc.io/v1/objects/43d08ed52c7af4e9f72769122501a5c15f99c7ace0c428a3eef040fd3f6fdbc5/paper-26.1.1-29.jar",
          "sha256": "43d08ed52c7af4e9f72769122501a5c15f99c7ace0c428a3eef040fd3f6fdbc5",
          "size": 52896049
        }
      }
    },
    {
      "minecraftVersion": "26.1",
      "family": "26.1",
      "mojang": {
        "releaseTime": "2026-03-24T12:11:04+00:00",
        "manifestSha1": "d6e4071ad771d30003e17727e8acd41283aef208",
        "manifestUrl": "https://piston-meta.mojang.com/v1/packages/d6e4071ad771d30003e17727e8acd41283aef208/26.1.json"
      },
      "paperBaseline": false,
      "availability": "unavailable",
      "unavailableReason": "Paper never shipped a build for this exact Mojang release.",
      "java": {
        "build": 25,
        "runtime": 25
      },
      "buildSystem": {
        "generation": "modern-paperweight",
        "gradle": null,
        "paperweight": null,
        "task": null,
        "artifactPath": null
      },
      "sourceBranch": null,
      "sourceImplemented": false,
      "supportTier": "unavailable",
      "capabilities": {
        "pluginApi": false,
        "victusCore": false,
        "nativeConfig": false,
        "dab": false,
        "asyncChunkSend": false,
        "lagDoctor": false,
        "metrics": false,
        "parallelTicking": false,
        "regionizedThreading": false,
        "fabricBridge": false,
        "neoForgeBridge": false
      },
      "tests": {
        "catalog": true,
        "patchApply": false,
        "unit": false,
        "boot": false,
        "bannerOrdering": false
      },
      "publicationEligible": false,
      "upstream": {
        "provider": "Paper",
        "project": "paper",
        "version": "26.1"
      }
    },
    {
      "minecraftVersion": "1.21.11",
      "family": "1.21",
      "mojang": {
        "releaseTime": "2025-12-09T12:23:30+00:00",
        "manifestSha1": "53338515d3ee0af37b9ba26553c0d5464bc51082",
        "manifestUrl": "https://piston-meta.mojang.com/v1/packages/53338515d3ee0af37b9ba26553c0d5464bc51082/1.21.11.json"
      },
      "paperBaseline": true,
      "availability": "planned",
      "unavailableReason": null,
      "java": {
        "build": 21,
        "runtime": 21
      },
      "buildSystem": {
        "generation": "modern-paperweight",
        "gradle": null,
        "paperweight": null,
        "task": null,
        "artifactPath": null
      },
      "sourceBranch": null,
      "sourceImplemented": false,
      "supportTier": "planned",
      "capabilities": {
        "pluginApi": false,
        "victusCore": false,
        "nativeConfig": false,
        "dab": false,
        "asyncChunkSend": false,
        "lagDoctor": false,
        "metrics": false,
        "parallelTicking": false,
        "regionizedThreading": false,
        "fabricBridge": false,
        "neoForgeBridge": false
      },
      "tests": {
        "catalog": true,
        "patchApply": false,
        "unit": false,
        "boot": false,
        "bannerOrdering": false
      },
      "publicationEligible": false,
      "upstream": {
        "provider": "Paper",
        "project": "paper",
        "version": "1.21.11",
        "build": 132,
        "channel": "stable",
        "buildTime": "2026-05-11T11:43:09Z",
        "commit": "c5eb0790f199da6c38d0a650e1e5cd5415b28185",
        "download": {
          "url": "https://fill-data.papermc.io/v1/objects/5ffef465eeeb5f2a3c23a24419d97c51afd7dbb4923ff42df9a3f58bba1ccfba/paper-1.21.11-132.jar",